{
  "schema_version": "2.0",
  "corpus_repository": "anavvanzin/iconocracy-corpus",
  "corpus_commit": "d5f8ad1d5eaf039f3837d13ad3eb6ef38dedf2b7",
  "corpus_sha256": "344e37d257821285c265bbbfd4ae61b23922a9df8d5c93f38c5b29a816b77e48",
  "baseline": {
    "commit": "b37ca5e2532d0ce88d3e6d7bb55a3f599c3d5f63",
    "acervo_sha256": "f0c174909fcdf41ca87995c7de576de41c5730b66175e51b45feff3ce7ec6fbf",
    "stats_sha256": "1ddc3eb7f44bc6c79646166c92db88e3de6f8d7e6fab27b6c6e12f952fd478a3",
    "corpus_enriched_sha256": "942929ca4d646ef849ce3bc637abc8033c2d3e4c9b6f769ea9a9c7c501eba77e"
  },
  "generated_at": "2026-09-15",
  "items": [
    {
      "canonical_id": "FR-087",
      "source_url": "https://gallica.bnf.fr/ark:/12148/btv1b6948145c.item",
      "slug": "allegorie-constitution-1791",
      "image": {
        "path": "assets/acervo/FR-087.webp",
        "source_url": "https://gallica.bnf.fr/iiif/ark:/12148/btv1b6948145c/f1/full/full/0/native.jpg",
        "catalog_url": "https://gallica.bnf.fr/ark:/12148/btv1b6948145c.item",
        "license": "Domínio público",
        "credit": "Bibliothèque nationale de France / Gallica",
        "alt": "Figura feminina coroada, sentada junto ao leão francês, sustenta a Constituição diante de um busto de Luís XVI."
      },
      "legacy_record_id": "FR-087",
      "legacy_ids": [],
      "editorial_status": "review",
      "constellations": [
        "constituicoes-atlanticas"
      ],
      "public_analysis": {
        "status": "draft",
        "summary": "A Constituição toma corpo feminino para articular nação, direitos e monarquia sob uma nova ordem escrita.",
        "panofsky": {
          "level_1": "Mulher coroada em vestes longas apresenta um volume aberto; leão, busto de Luís XVI, pedestais, inscrições e documentos estruturam a cena.",
          "level_2": "A figura personifica a Constituição ou a Nação constitucional. O leão e o retrato régio inserem a nova ordem na monarquia constitucional.",
          "level_3": "O corpo feminino torna a Constituição sensível, enquanto texto, rei e nação dividem a autoridade visual."
        },
        "indicators": {
          "desincorporacao": 0,
          "rigidez_postural": 1,
          "dessexualizacao": 1,
          "uniformizacao_facial": 1,
          "heraldizacao": 2,
          "enquadramento_arquitetonico": 1,
          "apagamento_narrativo": 1,
          "monocromatizacao": 0,
          "serialidade": 1,
          "inscricao_estatal": 3
        },
        "scale": "0–3; não aplicável quando não há figura feminina",
        "method_note": "Rascunho assistido seguido de adjudicação humana quando indicado. O índice composto histórico não é exibido nem recalculado."
      }
    },
    {
      "canonical_id": "FR-073",
      "source_url": "https://gallica.bnf.fr/ark:/12148/btv1b53009905z.item",
      "slug": "constitution-francaise-droits",
      "image": {
        "path": "assets/acervo/FR-073.webp",
        "source_url": "https://gallica.bnf.fr/iiif/ark:/12148/btv1b53009905z/f1/full/full/0/native.jpg",
        "catalog_url": "https://gallica.bnf.fr/ark:/12148/btv1b53009905z.item",
        "license": "Domínio público",
        "credit": "Bibliothèque nationale de France / Gallica",
        "alt": "Figura masculina erguida sobre um braseiro segura barrete vermelho e coroa, cercada por homens em celebração."
      },
      "legacy_record_id": "FR-073",
      "legacy_ids": [],
      "editorial_status": "review",
      "constellations": [
        "constituicoes-atlanticas"
      ],
      "public_analysis": {
        "status": "draft",
        "summary": "A fundação constitucional aparece por corpos masculinos e emblemas políticos, sem personificação feminina identificável.",
        "panofsky": {
          "level_1": "Figura masculina elevada segura barrete vermelho e coroa diante de uma multidão masculina; fumaça e raios concentram o eixo central.",
          "level_2": "Barrete, coroa e reunião pública articulam liberdade, monarquia e povo. A reprodução não sustenta a identificação de uma República feminina.",
          "level_3": "Como caso negativo, a obra mostra que a lei também foi corporificada sem feminilidade alegórica."
        },
        "indicators": null,
        "scale": "0–3; não aplicável quando não há figura feminina",
        "method_note": "Rascunho assistido seguido de adjudicação humana quando indicado. O índice composto histórico não é exibido nem recalculado.",
        "gender_attributed": "ausente"
      }
    },
    {
      "canonical_id": "ce773ab1-3bfc-9f6e-754a-efe0c567916d",
      "source_url": "https://www.museodelprado.es/en/the-collection/art-work/truth-has-died/8c3b0257-606f-4d0b-af9e-73f05de59697",
      "slug": "goya-murio-la-verdad",
      "image": {
        "path": "assets/acervo/ce773ab1-3bfc-9f6e-754a-efe0c567916d.webp",
        "source_url": "https://commons.wikimedia.org/wiki/File:Francisco_de_Goya_Muri%C3%B3_la_Verdad_(Desastres_79).jpg",
        "catalog_url": "https://www.museodelprado.es/en/the-collection/art-work/truth-has-died/8c3b0257-606f-4d0b-af9e-73f05de59697",
        "license": "Domínio público — PDM 1.0",
        "credit": "Francisco de Goya / Wikimedia Commons; ficha Museo del Prado",
        "alt": "A Verdade, figura feminina luminosa, jaz morta diante de um cortejo dominado por religiosos; uma mulher lamenta à direita."
      },
      "legacy_record_id": "ce773ab1-3bfc-9f6e-754a-efe0c567916d",
      "legacy_ids": [],
      "editorial_status": "review",
      "constellations": [
        "constituicoes-atlanticas"
      ],
      "public_analysis": {
        "status": "draft",
        "summary": "A Verdade morta transforma a restauração absolutista em violência visível contra a promessa constitucional.",
        "panofsky": {
          "level_1": "Corpo feminino luminoso jaz no chão; uma mulher se curva sobre ele e figuras masculinas, entre elas clérigos, cercam a cena escura.",
          "level_2": "A legenda identifica a morta como Verdade; luz e nudez separam seu corpo dos agentes do sepultamento.",
          "level_3": "A alegoria não legitima o Estado: torna visível a supressão da verdade pública e da promessa liberal da Constituição de Cádiz."
        },
        "indicators": {
          "desincorporacao": 0,
          "rigidez_postural": 0,
          "dessexualizacao": 0,
          "uniformizacao_facial": 1,
          "heraldizacao": 0,
          "enquadramento_arquitetonico": 0,
          "apagamento_narrativo": 0,
          "monocromatizacao": 3,
          "serialidade": 2,
          "inscricao_estatal": 0
        },
        "scale": "0–3; não aplicável quando não há figura feminina",
        "method_note": "Rascunho assistido seguido de adjudicação humana quando indicado. O índice composto histórico não é exibido nem recalculado."
      }
    },
    {
      "canonical_id": "324a90b6-403b-5b36-9bcf-d4c4db9efdc1",
      "source_url": "https://gallica.bnf.fr/ark:/12148/btv1b69481105",
      "slug": "nation-loi-roi-1791",
      "image": {
        "path": "assets/acervo/324a90b6-403b-5b36-9bcf-d4c4db9efdc1.webp",
        "source_url": "https://commons.wikimedia.org/wiki/File:La_Nation,_la_Loi,_le_Roi._Constitution_fran%C3%A7aise._(du_14_septembre_1791)_-_estampe_-_btv1b69481105.jpg",
        "catalog_url": "https://gallica.bnf.fr/ark:/12148/btv1b69481105",
        "license": "Domínio público",
        "credit": "Bibliothèque nationale de France / Gallica",
        "alt": "Figura feminina de barrete frígio apresenta a Constituição de 1791 monumentalizada, sob galo, bandeiras e raios."
      },
      "legacy_record_id": "324a90b6-403b-5b36-9bcf-d4c4db9efdc1",
      "legacy_ids": [],
      "editorial_status": "review",
      "constellations": [
        "constituicoes-atlanticas"
      ],
      "public_analysis": {
        "status": "approved",
        "summary": "A Nação feminina dá presença à soberania, mas o texto constitucional monumentalizado domina a imagem.",
        "panofsky": {
          "level_1": "Figura feminina de barrete frígio e seio exposto aparece à esquerda da Constituição; galo, globo, raios, bandeiras, lanças e ramos completam a composição.",
          "level_2": "A mulher personifica a Nação ou a França no vocabulário da Liberdade revolucionária e guarda a Constituição.",
          "level_3": "Produzida entre 1835 e 1841, a estampa reapresenta a Constituição de 1791 como patrimônio jurídico nacional."
        },
        "indicators": {
          "desincorporacao": 0,
          "rigidez_postural": 1,
          "dessexualizacao": 0,
          "uniformizacao_facial": 1,
          "heraldizacao": 2,
          "enquadramento_arquitetonico": 2,
          "apagamento_narrativo": 2,
          "monocromatizacao": 3,
          "serialidade": 1,
          "inscricao_estatal": 3
        },
        "scale": "0–3; não aplicável quando não há figura feminina",
        "method_note": "Rascunho assistido seguido de adjudicação humana quando indicado. O índice composto histórico não é exibido nem recalculado.",
        "approved_by": "ana",
        "approved_at": "2026-09-15"
      },
      "approved_by": "ana",
      "approved_at": "2026-09-15"
    },
    {
      "canonical_id": "FR-075",
      "source_url": "https://gallica.bnf.fr/ark:/12148/btv1b530172177.item",
      "slug": "proclamation-constitution-1848",
      "image": {
        "path": "assets/acervo/FR-075.webp",
        "source_url": "https://gallica.bnf.fr/iiif/ark:/12148/btv1b530172177/f1/full/full/0/native.jpg",
        "catalog_url": "https://gallica.bnf.fr/ark:/12148/btv1b530172177.item",
        "license": "Domínio público",
        "credit": "Bibliothèque nationale de France / Gallica",
        "alt": "Cena pública de proclamação da Constituição de 1848 conduzida por homens, dentro de moldura ornamental com bandeiras."
      },
      "legacy_record_id": "FR-075",
      "legacy_ids": [],
      "editorial_status": "review",
      "constellations": [
        "constituicoes-atlanticas"
      ],